{
  "schemaVersion": "1.0",
  "ledger": "~/dev/fz-plugin/tests/fixtures/gates/verdict/ledger.md",
  "gates": [
    {
      "id": "G1",
      "title": "첫째",
      "kind": "command",
      "measurement_fit": "fit",
      "noninteractive": true,
      "rerunnable": true,
      "determinism": "deterministic",
      "side_effects": "none",
      "verdict": "accept",
      "reason": "판정 근거",
      "suggestion": null
    },
    {
      "id": "G1",
      "title": "첫째",
      "kind": "command",
      "measurement_fit": "fit",
      "noninteractive": true,
      "rerunnable": true,
      "determinism": "deterministic",
      "side_effects": "none",
      "verdict": "accept",
      "reason": "판정 근거",
      "suggestion": null
    },
    {
      "id": "G3",
      "title": "셋째",
      "kind": "manual",
      "measurement_fit": "fit",
      "noninteractive": true,
      "rerunnable": true,
      "determinism": "deterministic",
      "side_effects": "none",
      "verdict": "accept",
      "reason": "판정 근거",
      "suggestion": null
    }
  ],
  "summary": {
    "total": 3,
    "accept": 3,
    "revise": 0,
    "demote_to_manual": 0
  }
}
